{
  "task_id": "rc-task-1",
  "motebit_id": "65b60673-d6ed-884b-b01c-2c222d82ada0",
  "device_id": "rc-device",
  "submitted_at": 1790000000000,
  "completed_at": 1790000001000,
  "status": "completed",
  "result": "Paid invoice #42 for $5.00.",
  "tools_used": [],
  "memories_formed": 0,
  "prompt_hash": "cf07194ee232eb531e15f690000d19846dea69cf05504782658afcfacb9228a2",
  "result_hash": "21ac289df93ec6d3e6b3a5cf3c548399a18269ab36f8c7b87e16b8169d6b629a",
  "public_key": "79b5562e8fe654f94078b112e8a98ba7901f853ae695bed7e0e3910bad049664",
  "suite": "motebit-jcs-ed25519-b64-v1",
  "delegation_receipts": [null],
  "signature": "oieFAZ3GYTAQqW2luZlX6_RynwBPMYiuTorrp3Uy4fgHze2o2mT82gDml4XGVdeSfy8vcKup-vygA06R_z43AA"
}
